{
  "schemaVersion": "1.0.0",
  "id": "lookup-savings-balance",
  "name": "lookup_savings_balance",
  "description": "look up the member and read their current savings balance",
  "revision": 1,
  "status": "approved",
  "appProfile": "mock-core-v1",
  "provenance": {
    "discoveryRunId": "4c1ef589-5345-4ec3-ba45-f5d48b303c27",
    "modelId": "zai:glm-5.3-flash",
    "createdAt": "2026-09-18T03:14:27.035Z",
    "sourceHash": "1dd0deb783c88b77"
  },
  "riskClass": "reversible",
  "policy": {
    "allowHosts": [
      "127.0.0.1",
      "localhost"
    ],
    "allowRoutes": [
      "/",
      "/lookup",
      "/member"
    ],
    "allowActions": [
      "navigate",
      "click",
      "type",
      "select",
      "press",
      "extract",
      "wait",
      "assert",
      "dismiss"
    ]
  },
  "parameters": [
    {
      "name": "memberId",
      "type": "string",
      "required": true,
      "sensitivity": "pii",
      "description": "id"
    }
  ],
  "outputs": [
    {
      "name": "savingsBalance",
      "type": "string",
      "sensitivity": "none",
      "description": "Current savings balance"
    }
  ],
  "entry": {
    "kind": "text",
    "value": "Member lookup"
  },
  "steps": [
    {
      "id": "s1",
      "action": "type",
      "target": {
        "candidates": [
          {
            "strategy": "role_name",
            "role": "textbox",
            "name": "Member ID",
            "weak": false
          }
        ],
        "fingerprint": {
          "role": "textbox",
          "name": "Member ID",
          "candidateCount": 1,
          "framePath": []
        },
        "framePath": []
      },
      "input": {
        "kind": "paramRef",
        "param": "memberId"
      },
      "waitFor": {
        "kind": "load",
        "timeoutMs": 8000
      },
      "riskClass": "reversible",
      "why": "Enter member ID to look up"
    },
    {
      "id": "s2",
      "action": "click",
      "target": {
        "candidates": [
          {
            "strategy": "role_name",
            "role": "button",
            "name": "Look up",
            "weak": false
          }
        ],
        "fingerprint": {
          "role": "button",
          "name": "Look up",
          "candidateCount": 1,
          "framePath": []
        },
        "framePath": []
      },
      "waitFor": {
        "kind": "load",
        "timeoutMs": 8000
      },
      "riskClass": "reversible",
      "why": "Member ID already entered; submit the lookup form."
    },
    {
      "id": "s3",
      "action": "extract",
      "target": {
        "candidates": [
          {
            "strategy": "role_name",
            "role": "status",
            "name": "Savings balance",
            "weak": false
          }
        ],
        "fingerprint": {
          "role": "status",
          "name": "Savings balance",
          "candidateCount": 1,
          "framePath": []
        },
        "framePath": []
      },
      "outputName": "savings_balance",
      "waitFor": {
        "kind": "load",
        "timeoutMs": 8000
      },
      "riskClass": "reversible",
      "why": "Reading the member's current savings balance, which is the goal."
    },
    {
      "id": "s4",
      "action": "extract",
      "target": {
        "candidates": [
          {
            "strategy": "role_name",
            "role": "status",
            "name": "Savings balance",
            "weak": false
          }
        ],
        "fingerprint": {
          "role": "status",
          "name": "Savings balance",
          "candidateCount": 1,
          "framePath": []
        },
        "framePath": []
      },
      "outputName": "savingsBalance",
      "waitFor": {
        "kind": "load",
        "timeoutMs": 8000
      },
      "riskClass": "reversible",
      "why": "Reading the member's current savings balance, which is the goal."
    },
    {
      "id": "s5",
      "action": "extract",
      "target": {
        "candidates": [
          {
            "strategy": "role_name",
            "role": "status",
            "name": "Savings balance",
            "weak": false
          }
        ],
        "fingerprint": {
          "role": "status",
          "name": "Savings balance",
          "candidateCount": 1,
          "framePath": []
        },
        "framePath": []
      },
      "outputName": "savingsBalance",
      "waitFor": {
        "kind": "load",
        "timeoutMs": 8000
      },
      "riskClass": "reversible",
      "why": "Goal is the member's current savings balance, visible as $1,842.17."
    }
  ],
  "outcomeDetectors": [
    {
      "afterStep": 1,
      "locator": {
        "candidates": [
          {
            "strategy": "text",
            "text": "No such member",
            "weak": false
          }
        ],
        "fingerprint": {
          "name": "No such member",
          "candidateCount": 1,
          "framePath": []
        },
        "framePath": []
      },
      "pattern": "No such member",
      "outcome": "MEMBER_NOT_FOUND"
    },
    {
      "afterStep": 1,
      "locator": {
        "candidates": [
          {
            "strategy": "text",
            "text": "Permission denied",
            "weak": false
          }
        ],
        "fingerprint": {
          "name": "Permission denied",
          "candidateCount": 1,
          "framePath": []
        },
        "framePath": []
      },
      "pattern": "Permission denied",
      "outcome": "PERMISSION_DENIED"
    },
    {
      "afterStep": 1,
      "locator": {
        "candidates": [
          {
            "strategy": "text",
            "text": "Account is frozen",
            "weak": false
          }
        ],
        "fingerprint": {
          "name": "Account is frozen",
          "candidateCount": 1,
          "framePath": []
        },
        "framePath": []
      },
      "pattern": "Account is frozen",
      "outcome": "ACCOUNT_FROZEN"
    },
    {
      "afterStep": 1,
      "locator": {
        "candidates": [
          {
            "strategy": "text",
            "text": "Estate hold",
            "weak": false
          }
        ],
        "fingerprint": {
          "name": "Estate hold",
          "candidateCount": 1,
          "framePath": []
        },
        "framePath": []
      },
      "pattern": "Estate hold",
      "outcome": "ESTATE_HOLD"
    },
    {
      "afterStep": 1,
      "locator": {
        "candidates": [
          {
            "strategy": "text",
            "text": "Member ID must be",
            "weak": false
          }
        ],
        "fingerprint": {
          "name": "Member ID must be",
          "candidateCount": 1,
          "framePath": []
        },
        "framePath": []
      },
      "pattern": "Member ID must be",
      "outcome": "VALIDATION_FAILED"
    }
  ],
  "success": {
    "kind": "text",
    "value": "Savings balance"
  },
  "knownOutcomes": [
    {
      "code": "MEMBER_NOT_FOUND",
      "description": "No member exists for the supplied ID"
    },
    {
      "code": "PERMISSION_DENIED",
      "description": "Operator is not allowed to view this record"
    },
    {
      "code": "ACCOUNT_FROZEN",
      "description": "Fraud or operational freeze blocks servicing"
    },
    {
      "code": "ESTATE_HOLD",
      "description": "Deceased member — supervisor and letters required"
    },
    {
      "code": "VALIDATION_FAILED",
      "description": "Member ID failed field validation"
    }
  ]
}
