{
  "schemaVersion": "1.0.0",
  "id": "lookup-savings-balance",
  "name": "lookup_savings_balance",
  "description": "look up the member and read their current savings balance",
  "revision": 1,
  "status": "approved",
  "appProfile": "mock-core-v1",
  "provenance": {
    "discoveryRunId": "e404d452-fb8b-4c90-8e79-874f613f94b7",
    "modelId": "venice:llama-3.3-70b",
    "createdAt": "2026-09-17T23:44:56.942Z",
    "sourceHash": "3fa451020963c6be"
  },
  "riskClass": "reversible",
  "policy": {
    "allowHosts": [
      "127.0.0.1",
      "localhost"
    ],
    "allowRoutes": [
      "/"
    ],
    "allowActions": [
      "navigate",
      "click",
      "type",
      "select",
      "press",
      "extract",
      "wait",
      "assert",
      "dismiss"
    ]
  },
  "parameters": [
    {
      "name": "memberId",
      "type": "string",
      "required": true,
      "sensitivity": "pii",
      "description": "id"
    }
  ],
  "outputs": [
    {
      "name": "savingsBalance",
      "type": "string",
      "sensitivity": "none",
      "description": "Current savings balance"
    }
  ],
  "entry": {
    "kind": "text",
    "value": "Member lookup"
  },
  "steps": [
    {
      "id": "s1",
      "action": "type",
      "target": {
        "candidates": [
          {
            "strategy": "role_name",
            "role": "textbox",
            "name": "Member ID",
            "weak": false
          }
        ],
        "fingerprint": {
          "role": "textbox",
          "name": "Member ID",
          "candidateCount": 1,
          "framePath": []
        },
        "framePath": []
      },
      "input": {
        "kind": "value",
        "value": "paramRef: member_id"
      },
      "waitFor": {
        "kind": "load",
        "timeoutMs": 8000
      },
      "riskClass": "reversible",
      "why": "enter the member ID to look up the member"
    },
    {
      "id": "s2",
      "action": "type",
      "target": {
        "candidates": [
          {
            "strategy": "role_name",
            "role": "textbox",
            "name": "Member ID",
            "weak": false
          }
        ],
        "fingerprint": {
          "role": "textbox",
          "name": "Member ID",
          "candidateCount": 1,
          "framePath": []
        },
        "framePath": []
      },
      "input": {
        "kind": "paramRef",
        "param": "member_id"
      },
      "waitFor": {
        "kind": "load",
        "timeoutMs": 8000
      },
      "riskClass": "reversible",
      "why": "enter the member ID to look up the member"
    },
    {
      "id": "s3",
      "action": "type",
      "target": {
        "candidates": [
          {
            "strategy": "role_name",
            "role": "textbox",
            "name": "Member ID",
            "weak": false
          }
        ],
        "fingerprint": {
          "role": "textbox",
          "name": "Member ID",
          "candidateCount": 1,
          "framePath": []
        },
        "framePath": []
      },
      "waitFor": {
        "kind": "load",
        "timeoutMs": 8000
      },
      "riskClass": "reversible",
      "why": "enter the member ID to look up the member"
    },
    {
      "id": "s4",
      "action": "type",
      "target": {
        "candidates": [
          {
            "strategy": "role_name",
            "role": "textbox",
            "name": "Member ID",
            "weak": false
          }
        ],
        "fingerprint": {
          "role": "textbox",
          "name": "Member ID",
          "candidateCount": 1,
          "framePath": []
        },
        "framePath": []
      },
      "waitFor": {
        "kind": "load",
        "timeoutMs": 8000
      },
      "riskClass": "reversible",
      "why": "enter the member ID to look up the member"
    }
  ],
  "outcomeDetectors": [
    {
      "afterStep": 1,
      "locator": {
        "candidates": [
          {
            "strategy": "text",
            "text": "No such member",
            "weak": false
          }
        ],
        "fingerprint": {
          "name": "No such member",
          "candidateCount": 1,
          "framePath": []
        },
        "framePath": []
      },
      "pattern": "No such member",
      "outcome": "MEMBER_NOT_FOUND"
    },
    {
      "afterStep": 1,
      "locator": {
        "candidates": [
          {
            "strategy": "text",
            "text": "Permission denied",
            "weak": false
          }
        ],
        "fingerprint": {
          "name": "Permission denied",
          "candidateCount": 1,
          "framePath": []
        },
        "framePath": []
      },
      "pattern": "Permission denied",
      "outcome": "PERMISSION_DENIED"
    },
    {
      "afterStep": 1,
      "locator": {
        "candidates": [
          {
            "strategy": "text",
            "text": "Member ID must be",
            "weak": false
          }
        ],
        "fingerprint": {
          "name": "Member ID must be",
          "candidateCount": 1,
          "framePath": []
        },
        "framePath": []
      },
      "pattern": "Member ID must be",
      "outcome": "VALIDATION_FAILED"
    }
  ],
  "success": {
    "kind": "text",
    "value": "Savings balance"
  },
  "knownOutcomes": [
    {
      "code": "MEMBER_NOT_FOUND",
      "description": "No member exists for the supplied ID"
    },
    {
      "code": "PERMISSION_DENIED",
      "description": "Operator is not allowed to view this record"
    },
    {
      "code": "VALIDATION_FAILED",
      "description": "Member ID failed field validation"
    }
  ]
}
