{
  "schemaVersion": "1.0.0",
  "id": "lookup-savings-balance",
  "name": "lookup_savings_balance",
  "description": "look up the member and read their current savings balance",
  "revision": 1,
  "status": "draft",
  "appProfile": "mock-core-v1",
  "provenance": {
    "discoveryRunId": "fe5c1ff1-2118-42bf-bd45-1ce77a73ab31",
    "modelId": "venice:llama-3.3-70b",
    "createdAt": "2026-09-18T00:01:39.738Z",
    "sourceHash": "fc065ef74d17724c"
  },
  "riskClass": "reversible",
  "policy": {
    "allowHosts": [
      "127.0.0.1",
      "localhost"
    ],
    "allowRoutes": [
      "/",
      "/lookup",
      "/member"
    ],
    "allowActions": [
      "navigate",
      "click",
      "type",
      "select",
      "press",
      "extract",
      "wait",
      "assert",
      "dismiss"
    ]
  },
  "parameters": [
    {
      "name": "memberId",
      "type": "string",
      "required": true,
      "sensitivity": "pii",
      "description": "id"
    }
  ],
  "outputs": [
    {
      "name": "savingsBalance",
      "type": "string",
      "sensitivity": "none",
      "description": "Current savings balance"
    }
  ],
  "entry": {
    "kind": "text",
    "value": "Member lookup"
  },
  "steps": [
    {
      "id": "s1",
      "action": "type",
      "target": {
        "candidates": [
          {
            "strategy": "role_name",
            "role": "textbox",
            "name": "Member ID",
            "weak": false
          }
        ],
        "fingerprint": {
          "role": "textbox",
          "name": "Member ID",
          "candidateCount": 1,
          "framePath": []
        },
        "framePath": []
      },
      "input": {
        "kind": "paramRef",
        "param": "memberId"
      },
      "waitFor": {
        "kind": "load",
        "timeoutMs": 8000
      },
      "riskClass": "reversible",
      "why": "Enter the member ID to look up the member"
    },
    {
      "id": "s2",
      "action": "type",
      "target": {
        "candidates": [
          {
            "strategy": "role_name",
            "role": "textbox",
            "name": "Member ID",
            "weak": false
          }
        ],
        "fingerprint": {
          "role": "textbox",
          "name": "Member ID",
          "candidateCount": 1,
          "framePath": []
        },
        "framePath": []
      },
      "input": {
        "kind": "paramRef",
        "param": "memberId"
      },
      "waitFor": {
        "kind": "load",
        "timeoutMs": 8000
      },
      "riskClass": "reversible",
      "why": "Enter the member ID to look up the member"
    },
    {
      "id": "s3",
      "action": "click",
      "target": {
        "candidates": [
          {
            "strategy": "role_name",
            "role": "button",
            "name": "Look up",
            "weak": false
          }
        ],
        "fingerprint": {
          "role": "button",
          "name": "Look up",
          "candidateCount": 1,
          "framePath": []
        },
        "framePath": []
      },
      "waitFor": {
        "kind": "load",
        "timeoutMs": 8000
      },
      "riskClass": "reversible",
      "why": "Click the submit control after typing the member ID to look up the member"
    },
    {
      "id": "s4",
      "action": "extract",
      "target": {
        "candidates": [
          {
            "strategy": "role_name",
            "role": "status",
            "name": "Savings balance",
            "weak": false
          }
        ],
        "fingerprint": {
          "role": "status",
          "name": "Savings balance",
          "candidateCount": 1,
          "framePath": []
        },
        "framePath": []
      },
      "waitFor": {
        "kind": "load",
        "timeoutMs": 8000
      },
      "riskClass": "reversible",
      "why": "read the member's current savings balance"
    },
    {
      "id": "s5",
      "action": "extract",
      "target": {
        "candidates": [
          {
            "strategy": "role_name",
            "role": "status",
            "name": "Savings balance",
            "weak": false
          }
        ],
        "fingerprint": {
          "role": "status",
          "name": "Savings balance",
          "candidateCount": 1,
          "framePath": []
        },
        "framePath": []
      },
      "outputName": "savingsBalance",
      "waitFor": {
        "kind": "load",
        "timeoutMs": 8000
      },
      "riskClass": "reversible",
      "why": "read the member's current savings balance"
    }
  ],
  "outcomeDetectors": [
    {
      "afterStep": 2,
      "locator": {
        "candidates": [
          {
            "strategy": "text",
            "text": "No such member",
            "weak": false
          }
        ],
        "fingerprint": {
          "name": "No such member",
          "candidateCount": 1,
          "framePath": []
        },
        "framePath": []
      },
      "pattern": "No such member",
      "outcome": "MEMBER_NOT_FOUND"
    },
    {
      "afterStep": 2,
      "locator": {
        "candidates": [
          {
            "strategy": "text",
            "text": "Permission denied",
            "weak": false
          }
        ],
        "fingerprint": {
          "name": "Permission denied",
          "candidateCount": 1,
          "framePath": []
        },
        "framePath": []
      },
      "pattern": "Permission denied",
      "outcome": "PERMISSION_DENIED"
    },
    {
      "afterStep": 2,
      "locator": {
        "candidates": [
          {
            "strategy": "text",
            "text": "Member ID must be",
            "weak": false
          }
        ],
        "fingerprint": {
          "name": "Member ID must be",
          "candidateCount": 1,
          "framePath": []
        },
        "framePath": []
      },
      "pattern": "Member ID must be",
      "outcome": "VALIDATION_FAILED"
    }
  ],
  "success": {
    "kind": "text",
    "value": "Savings balance"
  },
  "knownOutcomes": [
    {
      "code": "MEMBER_NOT_FOUND",
      "description": "No member exists for the supplied ID"
    },
    {
      "code": "PERMISSION_DENIED",
      "description": "Operator is not allowed to view this record"
    },
    {
      "code": "VALIDATION_FAILED",
      "description": "Member ID failed field validation"
    }
  ]
}
